{
  "schema_version": 1,
  "handoff_id": "20260825T082027055Z-5a8a372b",
  "created_at": "2026-08-25T08:20:27.0592270+00:00",
  "role": "architect",
  "phase": "P00",
  "summary": "Package integrity, immutable source extraction, repository initialization, toolchain discovery, and source-baseline generation completed.",
  "completed": [
    "Validated package manifest and immutable source hashes",
    "Installed governing instructions",
    "Initialized durable state and Git repository",
    "Generated initial source and MCP baselines"
  ],
  "open_work": [],
  "next_actions": [
    "Execute P01 toolchain provisioning and pin exact versions",
    "Execute P02 source archaeology and expand parity evidence"
  ],
  "evidence": [
    ".forge-inputs/source-roots.json",
    ".forge-codex/state/toolchain.json",
    ".forge-codex/state/baseline/macos-swift-source-index.json"
  ],
  "decisions": [],
  "blockers": [],
  "repository_status": "## main...origin/main\r\n M .gitignore\r\n M .vscode/launch.json\r\n M .vscode/tasks.json\r\n M AGENTS.md\r\n D CHANGELOG.md\r\n M Directory.Build.props\r\n D Directory.Build.targets\r\n D ForgeConductor.sln\r\n D LICENSE\r\n D NOTICE\r\n M README.md\r\n D USER-GUIDE.md\r\n D docs/ARCHITECTURE.md\r\n D docs/AUDIT-2026-08-15.md\r\n D docs/PACKAGING.md\r\n D installer/ForgeConductor.Setup/ForgeConductor.Setup.wixproj\r\n D installer/ForgeConductor.Setup/Package.wxs\r\n D resources/Agents/debug.md\r\n D resources/Agents/docs.md\r\n D resources/Agents/explore.md\r\n D resources/Agents/implement.md\r\n D resources/Agents/plan.md\r\n D resources/Agents/precommit-audit.md\r\n D resources/Agents/research.md\r\n D resources/Agents/review.md\r\n D resources/Agents/security.md\r\n D resources/Agents/test.md\r\n D resources/Icons/ForgeConductor.ico\r\n D resources/Icons/forge-conductor-1024.png\r\n D resources/Icons/forge-conductor-128.png\r\n D resources/Icons/forge-conductor-16.png\r\n D resources/Icons/forge-conductor-256.png\r\n D resources/Icons/forge-conductor-32.png\r\n D resources/Icons/forge-conductor-512.png\r\n D resources/Icons/forge-conductor-64.png\r\n D resources/Manifests/ComfyModule.json\r\n D resources/Manifests/LmStudioModule.json\r\n D resources/Manifests/ManagerModule.json\r\n D resources/Manifests/McpModule.json\r\n D resources/Manifests/OperatorAppModule.json\r\n D resources/Manifests/OrchestrationModule.json\r\n D resources/Manifests/PersistenceModule.json\r\n D resources/Manifests/TelemetryModule.json\r\n M scripts/build.ps1\r\n D scripts/generate-vcxproj.ps1\r\n M scripts/package.ps1\r\n M scripts/test.ps1\r\n D src/ForgeComfy/ForgeComfy.vcxproj\r\n D src/ForgeComfy/include/ForgeComfy/ComfyClient.h\r\n D src/ForgeComfy/include/ForgeComfy/ComfyControl.h\r\n D src/ForgeComfy/include/ForgeComfy/ComfyProcess.h\r\n D src/ForgeComfy/include/ForgeComfy/ComfySettings.h\r\n D src/ForgeComfy/include/ForgeComfy/ComfyStore.h\r\n D src/ForgeComfy/src/ComfyClient.cpp\r\n D src/ForgeComfy/src/ComfyControl.cpp\r\n D src/ForgeComfy/src/ComfyProcess.cpp\r\n D src/ForgeComfy/src/ComfySettings.cpp\r\n D src/ForgeComfy/src/ComfyStore.cpp\r\n D src/ForgeConductorApp/ForgeConductorApp.vcxproj\r\n D src/ForgeConductorApp/Main.cpp\r\n D src/ForgeConductorApp/OperatorWindow.cpp\r\n D src/ForgeConductorApp/OperatorWindow.h\r\n D src/ForgeConductorApp/app.manifest\r\n D src/ForgeConductorApp/app.rc\r\n D src/ForgeDomain/ForgeDomain.vcxproj\r\n D src/ForgeDomain/include/ForgeDomain/Clock.h\r\n D src/ForgeDomain/include/ForgeDomain/Models.h\r\n D src/ForgeDomain/include/ForgeDomain/Ports.h\r\n D src/ForgeDomain/include/ForgeDomain/Version.h\r\n D src/ForgeDomain/src/Clock.cpp\r\n D src/ForgeGaugeKit/ForgeGaugeKit.vcxproj\r\n D src/ForgeGaugeKit/include/ForgeGaugeKit/GaugeRenderer.h\r\n D src/ForgeGaugeKit/src/GaugeRenderer.cpp\r\n D src/ForgeHost/ForgeHost.vcxproj\r\n D src/ForgeHost/include/ForgeHost/HostBootstrap.h\r\n D src/ForgeHost/include/ForgeHost/LaunchOptions.h\r\n D src/ForgeHost/src/HostBootstrap.cpp\r\n D src/ForgeLmStudio/ForgeLmStudio.vcxproj\r\n D src/ForgeLmStudio/include/ForgeLmStudio/LmStudioDeploy.h\r\n D src/ForgeLmStudio/src/LmStudioDeploy.cpp\r\n D src/ForgeManager/ForgeManager.vcxproj\r\n D src/ForgeManager/include/ForgeManager/ManagerController.h\r\n D src/ForgeManager/src/ManagerController.cpp\r\n D src/ForgeMcp/ForgeMcp.vcxproj\r\n D src/ForgeMcp/include/ForgeMcp/McpServer.h\r\n D src/ForgeMcp/src/McpServer.cpp\r\n D src/ForgeOrchestration/ForgeOrchestration.vcxproj\r\n D src/ForgeOrchestration/include/ForgeOrchestration/AgentCatalog.h\r\n D src/ForgeOrchestration/include/ForgeOrchestration/ForgeServices.h\r\n D src/ForgeOrchestration/include/ForgeOrchestration/PdfWriter.h\r\n D src/ForgeOrchestration/include/ForgeOrchestration/ProcessRunner.h\r\n D src/ForgeOrchestration/include/ForgeOrchestration/Sessions.h\r\n D src/ForgeOrchestration/include/ForgeOrchestration/ToolRouter.h\r\n D src/ForgeOrchestration/src/AgentCatalog.cpp\r\n D src/ForgeOrchestration/src/ForgeServices.cpp\r\n D src/ForgeOrchestration/src/PdfWriter.cpp\r\n D src/ForgeOrchestration/src/ProcessRunner.cpp\r\n D src/ForgeOrchestration/src/Sessions.cpp\r\n D src/ForgeOrchestration/src/ToolPacks.cpp\r\n D src/ForgeOrchestration/src/ToolRouter.cpp\r\n D src/ForgePersistence/ForgePersistence.vcxproj\r\n D src/ForgePersistence/include/ForgePersistence/AppPaths.h\r\n D src/ForgePersistence/include/ForgePersistence/AuditService.h\r\n D src/ForgePersistence/include/ForgePersistence/ConfigStore.h\r\n D src/ForgePersistence/include/ForgePersistence/SQLiteStore.h\r\n D src/ForgePersistence/src/AppPaths.cpp\r\n D src/ForgePersistence/src/AuditService.cpp\r\n D src/ForgePersistence/src/ConfigStore.cpp\r\n D src/ForgePersistence/src/SQLiteStore.cpp\r\n D src/ForgePlatform/ForgePlatform.vcxproj\r\n D src/ForgePlatform/include/ForgePlatform/HttpClient.h\r\n D src/ForgePlatform/include/ForgePlatform/HttpUrl.h\r\n D src/ForgePlatform/include/ForgePlatform/InstanceLock.h\r\n D src/ForgePlatform/include/ForgePlatform/WinPaths.h\r\n D src/ForgePlatform/src/HttpClient.cpp\r\n D src/ForgePlatform/src/HttpUrl.cpp\r\n D src/ForgePlatform/src/InstanceLock.cpp\r\n D src/ForgePlatform/src/WinPaths.cpp\r\n D src/ForgeRuntime/ForgeRuntime.vcxproj\r\n D src/ForgeRuntime/include/ForgeRuntime/CapabilityPolicy.h\r\n D src/ForgeRuntime/include/ForgeRuntime/EventBus.h\r\n D src/ForgeRuntime/include/ForgeRuntime/Logger.h\r\n D src/ForgeRuntime/include/ForgeRuntime/ManifestLoader.h\r\n D src/ForgeRuntime/include/ForgeRuntime/ModuleContext.h\r\n D src/ForgeRuntime/include/ForgeRuntime/ModuleManager.h\r\n D src/ForgeRuntime/include/ForgeRuntime/ModuleModels.h\r\n D src/ForgeRuntime/include/ForgeRuntime/ModuleRegistry.h\r\n D src/ForgeRuntime/include/ForgeRuntime/Protocols.h\r\n D src/ForgeRuntime/include/ForgeRuntime/Runtime.h\r\n D src/ForgeRuntime/include/ForgeRuntime/SemVer.h\r\n D src/ForgeRuntime/include/ForgeRuntime/ServiceContainer.h\r\n D src/ForgeRuntime/include/ForgeRuntime/UIModels.h\r\n D src/ForgeRuntime/include/ForgeRuntime/UISurfaceManager.h\r\n D src/ForgeRuntime/src/CapabilityPolicy.cpp\r\n D src/ForgeRuntime/src/EventBus.cpp\r\n D src/ForgeRuntime/src/Logger.cpp\r\n D src/ForgeRuntime/src/ManifestLoader.cpp\r\n D src/ForgeRuntime/src/ModuleContext.cpp\r\n D src/ForgeRuntime/src/ModuleManager.cpp\r\n D src/ForgeRuntime/src/ModuleModels.cpp\r\n D src/ForgeRuntime/src/ModuleRegistry.cpp\r\n D src/ForgeRuntime/src/Runtime.cpp\r\n D src/ForgeRuntime/src/SemVer.cpp\r\n D src/ForgeRuntime/src/ServiceContainer.cpp\r\n D src/ForgeRuntime/src/UISurfaceManager.cpp\r\n D src/ForgeTelemetry/ForgeTelemetry.vcxproj\r\n D src/ForgeTelemetry/include/ForgeTelemetry/TelemetryService.h\r\n D src/ForgeTelemetry/src/TelemetryService.cpp\r\n D src/ForgeUi/ForgeUi.vcxproj\r\n D src/ForgeUi/include/ForgeUi/OperatorSurface.h\r\n D src/ForgeUi/src/OperatorSurface.cpp\r\n D src/Modules/OperatorAppModule/ForgeModules.vcxproj\r\n D src/Modules/OperatorAppModule/OperatorModules.cpp\r\n D src/Modules/OperatorAppModule/OperatorModules.h\r\n D tests/ForgeConductor.McpSmoke/ForgeConductor.McpSmoke.vcxproj\r\n D tests/ForgeConductor.McpSmoke/McpSmoke.cpp\r\n D tests/ForgeConductor.Tests/ForgeConductor.Tests.vcxproj\r\n D tests/ForgeConductor.Tests/Tests.cpp\r\n D third_party/nlohmann/json.hpp\r\n M vcpkg.json\r\n?? .editorconfig\r\n?? .forge-codex/\r\n?? .vscode/settings.json\r\n?? CMakeLists.txt\r\n?? CMakePresets.json\r\n?? manifests/\r\n?? packaging/\r\n?? scripts/Run-All-Gates.ps1\r\n?? src/Bootstrap/",
  "content_sha256": "5ebfe1ef7cc1aab817d5128eeca19ddb12e5ad1f22c05b87391bce5a98391e01"
}
