{
  "schema_version": 1,
  "handoff_id": "20260827T165650467Z-4e3482a6",
  "created_at": "2026-08-27T16:56:50.4758641+00:00",
  "role": "validator",
  "phase": "P15",
  "summary": "P15/G15 passed on the owner current Windows 11 x64 machine in Debug configuration. LM Studio remains running and the successful Forge-owned deployment remains installed. Qualification is machine-local; UI/CLI composition and post-alpha deferrals remain open, with no active blocker.",
  "completed": [
    "G15 passed from one authoritative affected-target rebuild and one authoritative five-test CTest invocation; all five deterministic tests passed.",
    "The seventh real-host attempt committed the Forge-owned primary and fallback LM Studio deployment, synchronized exact revision a2e8ee58-9ac8-442c-b19d-108a7f002f26, preserved foreign content, and left zero transaction roots.",
    "Independent Validator approval verified all retained commands, streams, source hashes, artifact hashes, and current-host residue without rebuilding, testing, or launching the host.",
    "Feature parity rows MCP-005, MCP-006, and MCP-007 are passed with implementation, test, evidence, and ADR references."
  ],
  "open_work": [
    "P16/G16 Manager process, current-user authenticated IPC, startup ownership, restart/shutdown, and loopback dashboard.",
    "UI-006 LM Studio MCP surface remains open for P20 native WinUI composition and retained UI automation.",
    "CLI-002 LM Studio deploy command remains open for P21 CLI composition.",
    "The real-host result records ready_role_count 0 because LM Studio creates role processes lazily; G15 proves exact host synchronization rather than live per-chat role readiness.",
    "Security-only hardening, broad installer matrix, clean-environment qualification, and bespoke UI polish remain deferred until after alpha under OWNER-002."
  ],
  "next_actions": [
    "Open P16 as in progress after committing and pushing this P15 completion checkpoint.",
    "Implement P16-A manager composition root, current-user single-instance ownership, bounded named-pipe protocol, client, lifecycle, executable, and focused process tests.",
    "Add P16-B loopback dashboard and P16-C watchdog/startup/reconciliation slices before the single authoritative G16 gate invocation."
  ],
  "evidence": [
    ".forge-codex/state/gate-results/G15.json",
    ".forge-codex/state/validator-reports/P15-G15.json",
    ".forge-codex/state/commands/20260827T141837131Z-e0c0a3a9.json",
    ".forge-codex/state/commands/20260827T164043279Z-b202ffac.json",
    ".forge-codex/state/evidence/P15/g15-validation-summary.json",
    ".forge-codex/state/evidence/P15/windows-lm-studio-real-host.json",
    ".forge-codex/instructions/plans/feature-parity-matrix.json",
    ".forge-codex/instructions/plans/feature-parity-matrix.tsv",
    ".forge-codex/state/evidence-index.json"
  ],
  "decisions": [
    ".forge-codex/state/decisions/OWNER-002-alpha-release-qualification-scope.md",
    ".forge-codex/state/decisions/P15-001-evidence-based-lm-studio-deployment-and-maintenance-authority.md",
    ".forge-codex/state/decisions/P15-002-packaged-localappdata-process-path-equivalence.md",
    ".forge-codex/state/decisions/P15-003-lmstudio-preflight-runtime-environment-and-packaged-storage.md",
    ".forge-codex/state/decisions/P15-004-lmstudio-configuration-file-object-transaction.md"
  ],
  "blockers": [],
  "repository_status": "## main...origin/main\r\n M .forge-codex/instructions/plans/feature-parity-matrix.json\r\n M .forge-codex/instructions/plans/feature-parity-matrix.tsv\r\n M .forge-codex/state/event-ledger.jsonl\r\n M .forge-codex/state/evidence-index.json\r\n M .forge-codex/state/run-state.json\r\n?? .forge-codex/state/gate-results/G15.json\r\n?? .forge-codex/state/validator-reports/P15-G15.json",
  "content_sha256": "0dde1ca28271dc5308a549c83931216d302566eaa5d4a089dbc13ea6b57ded0a"
}
